{
  "schema_version": 1,
  "fetched_at": "2026-03-09T12:00:00Z",
  "record_type": "message",
  "external_id": "msg-001",
  "provider_url": "https://mail.example.com/m/msg-001",
  "thread_external_id": "thr-001",
  "sent_at": "2026-03-09T11:58:00Z",
  "from_addr": "client@example.com",
  "to_addrs": [
    "me@example.org"
  ],
  "subject": "Invoice",
  "body_text": "Hi",
  "body_html_sanitized": "<p>Hi</p>",
  "labels": [
    "inbox"
  ]
}
